{
  "id": "black_hole",
  "display_name_key": "BIOME_BLACK_HOLE",
  "palette": {
    "background": "#030812",
    "nebula": "#5f2b7a",
    "accent": "#ffdca2"
  },
  "visual_profile": {
    "primary_asset": "res://assets/original/destinations/black_hole_hd.webp",
    "primary_scale": 1.75,
    "primary_anchor": [
      0.5,
      0.25
    ],
    "primary_parallax": 0.056,
    "primary_rotation_speed": 0.006,
    "atmosphere_color": "#ffdca2",
    "atmosphere_strength": 0.52,
    "shimmer_strength": 0.1,
    "traffic_count": 6,
    "dust_density": 1.37,
    "horizon_style": "anomaly",
    "horizon_intensity": 0.75,
    "primary_reference_size": 512
  },
  "environment": {
    "salvage_mass_multiplier": 1.16,
    "volumes": [
      {
        "kind": "gravity_well",
        "count_range": [
          1,
          2
        ],
        "shape": "circle",
        "strength_range": [
          0.18,
          0.4
        ],
        "placement": "random",
        "color": "#ffdca2",
        "secondary_color": "#5f2b7a",
        "radius_range": [
          460,
          820
        ]
      },
      {
        "kind": "tractor_distortion",
        "count_range": [
          1,
          2
        ],
        "shape": "circle",
        "strength_range": [
          0.24,
          0.48
        ],
        "placement": "random",
        "color": "#ffdca2",
        "secondary_color": "#5f2b7a",
        "radius_range": [
          450,
          760
        ]
      },
      {
        "kind": "visibility_pocket",
        "count_range": [
          1,
          2
        ],
        "shape": "circle",
        "strength_range": [
          0.28,
          0.56
        ],
        "placement": "random",
        "color": "#ffdca2",
        "secondary_color": "#5f2b7a",
        "radius_range": [
          520,
          920
        ]
      }
    ]
  },
  "salvage_tables": [
    "blue_nebula_research"
  ],
  "landmarks": [
    "derelict_explorer",
    "comms_array"
  ],
  "modifiers": [
    "light_debris",
    "dense_debris",
    "valuable_salvage",
    "sparse_corridor",
    "meteor_front",
    "rich_recovery",
    "quiet_orbit"
  ],
  "spawn_rules": {
    "min_spacing": 156,
    "edge_margin": 355,
    "starter_cluster_count": 2,
    "starter_cluster_radius": 320
  },
  "obstacles": [
    {
      "id": "nebula_fragment_01",
      "sprite": "res://assets/original/obstacles/blue_nebula/nebula_fragment_01_hd.webp",
      "weight": 20,
      "collision_radius": 52,
      "scale_min": 0.84,
      "scale_max": 1.06,
      "texture_reference_size": 128,
      "sprite_modulate": "#ffffffff"
    },
    {
      "id": "nebula_fragment_02",
      "sprite": "res://assets/original/obstacles/blue_nebula/nebula_fragment_02_hd.webp",
      "weight": 21,
      "collision_radius": 45,
      "scale_min": 0.82,
      "scale_max": 1.08,
      "texture_reference_size": 128,
      "sprite_modulate": "#ffffffff"
    },
    {
      "id": "nebula_fragment_03",
      "sprite": "res://assets/original/obstacles/blue_nebula/nebula_fragment_03_hd.webp",
      "weight": 20,
      "collision_radius": 38,
      "scale_min": 0.82,
      "scale_max": 1.08,
      "texture_reference_size": 128,
      "sprite_modulate": "#ffffffff"
    },
    {
      "id": "nebula_fragment_04",
      "sprite": "res://assets/original/obstacles/blue_nebula/nebula_fragment_04_hd.webp",
      "weight": 19,
      "collision_radius": 31,
      "scale_min": 0.8,
      "scale_max": 1.1,
      "texture_reference_size": 128,
      "sprite_modulate": "#ffffffff"
    },
    {
      "id": "nebula_fragment_05",
      "sprite": "res://assets/original/obstacles/blue_nebula/nebula_fragment_05_hd.webp",
      "weight": 20,
      "collision_radius": 24,
      "scale_min": 0.78,
      "scale_max": 1.12,
      "texture_reference_size": 128,
      "sprite_modulate": "#ffffffff"
    }
  ],
  "obstacle_art_family": "nebula"
}
