{
  "id": "binary_star",
  "display_name_key": "BIOME_BINARY_STAR",
  "palette": {
    "background": "#030812",
    "nebula": "#6db6ff",
    "accent": "#fff0b0"
  },
  "visual_profile": {
    "primary_asset": "res://assets/original/destinations/binary_star.svg",
    "primary_scale": 1.95,
    "primary_anchor": [
      0.8,
      0.75
    ],
    "primary_parallax": 0.064,
    "primary_rotation_speed": -0.004,
    "atmosphere_color": "#fff0b0",
    "atmosphere_strength": 0.6,
    "shimmer_strength": 0.14,
    "traffic_count": 0,
    "dust_density": 0.45,
    "horizon_style": "solar",
    "horizon_intensity": 0.8500000000000001
  },
  "environment": {
    "salvage_mass_multiplier": 1.23,
    "volumes": [
      {
        "kind": "gravity_well",
        "count_range": [
          1,
          2
        ],
        "shape": "circle",
        "strength_range": [
          0.18,
          0.4
        ],
        "placement": "random",
        "color": "#fff0b0",
        "secondary_color": "#6db6ff",
        "radius_range": [
          460,
          820
        ]
      },
      {
        "kind": "drift_current",
        "count_range": [
          1,
          2
        ],
        "shape": "box",
        "strength_range": [
          0.18,
          0.38
        ],
        "placement": "random",
        "color": "#fff0b0",
        "secondary_color": "#6db6ff",
        "length_range": [
          2400,
          4800
        ],
        "width_range": [
          520,
          980
        ]
      }
    ]
  },
  "salvage_tables": [
    "blue_nebula_research"
  ],
  "landmarks": [
    "relay_satellite",
    "research_outpost"
  ],
  "modifiers": [
    "light_debris",
    "dense_debris",
    "valuable_salvage",
    "sparse_corridor",
    "meteor_front",
    "rich_recovery",
    "quiet_orbit"
  ],
  "spawn_rules": {
    "min_spacing": 164,
    "edge_margin": 380,
    "starter_cluster_count": 3,
    "starter_cluster_radius": 340
  },
  "obstacles": [
    {
      "id": "nebula_fragment_01",
      "sprite": "res://assets/original/obstacles/blue_nebula/nebula_fragment_01_hd.webp",
      "weight": 20,
      "collision_radius": 52,
      "scale_min": 0.84,
      "scale_max": 1.06,
      "texture_reference_size": 128,
      "sprite_modulate": "#ffffffff"
    },
    {
      "id": "nebula_fragment_02",
      "sprite": "res://assets/original/obstacles/blue_nebula/nebula_fragment_02_hd.webp",
      "weight": 21,
      "collision_radius": 45,
      "scale_min": 0.82,
      "scale_max": 1.08,
      "texture_reference_size": 128,
      "sprite_modulate": "#ffffffff"
    },
    {
      "id": "nebula_fragment_03",
      "sprite": "res://assets/original/obstacles/blue_nebula/nebula_fragment_03_hd.webp",
      "weight": 20,
      "collision_radius": 38,
      "scale_min": 0.82,
      "scale_max": 1.08,
      "texture_reference_size": 128,
      "sprite_modulate": "#ffffffff"
    },
    {
      "id": "nebula_fragment_04",
      "sprite": "res://assets/original/obstacles/blue_nebula/nebula_fragment_04_hd.webp",
      "weight": 19,
      "collision_radius": 31,
      "scale_min": 0.8,
      "scale_max": 1.1,
      "texture_reference_size": 128,
      "sprite_modulate": "#ffffffff"
    },
    {
      "id": "nebula_fragment_05",
      "sprite": "res://assets/original/obstacles/blue_nebula/nebula_fragment_05_hd.webp",
      "weight": 20,
      "collision_radius": 24,
      "scale_min": 0.78,
      "scale_max": 1.12,
      "texture_reference_size": 128,
      "sprite_modulate": "#ffffffff"
    }
  ],
  "obstacle_art_family": "nebula"
}
