{
  "id": "red_giant",
  "display_name_key": "BIOME_RED_GIANT",
  "palette": {
    "background": "#030812",
    "nebula": "#b52e32",
    "accent": "#ffd091"
  },
  "visual_profile": {
    "primary_asset": "res://assets/original/destinations/red_giant_hd.webp",
    "primary_scale": 1.75,
    "primary_anchor": [
      0.2,
      0.25
    ],
    "primary_parallax": 0.056,
    "primary_rotation_speed": 0.006,
    "atmosphere_color": "#ffd091",
    "atmosphere_strength": 0.88,
    "shimmer_strength": 0.2,
    "traffic_count": 2,
    "dust_density": 0.65,
    "horizon_style": "solar",
    "horizon_intensity": 1,
    "primary_reference_size": 512,
    "effect_profile": "solar",
    "effect_intensity": 1
  },
  "environment": {
    "salvage_mass_multiplier": 0.88,
    "volumes": [
      {
        "kind": "drift_current",
        "count_range": [
          1,
          2
        ],
        "shape": "box",
        "strength_range": [
          0.18,
          0.38
        ],
        "placement": "random",
        "color": "#ffd091",
        "secondary_color": "#b52e32",
        "length_range": [
          2400,
          4800
        ],
        "width_range": [
          520,
          980
        ]
      },
      {
        "kind": "scanner_interference",
        "count_range": [
          1,
          2
        ],
        "shape": "circle",
        "strength_range": [
          0.28,
          0.54
        ],
        "placement": "random",
        "color": "#ffd091",
        "secondary_color": "#b52e32",
        "radius_range": [
          460,
          780
        ]
      }
    ]
  },
  "salvage_tables": [
    "blue_nebula_research"
  ],
  "landmarks": [
    "research_outpost",
    "cargo_waystation"
  ],
  "modifiers": [
    "light_debris",
    "dense_debris",
    "valuable_salvage",
    "sparse_corridor",
    "meteor_front",
    "rich_recovery",
    "quiet_orbit"
  ],
  "spawn_rules": {
    "min_spacing": 156,
    "edge_margin": 330,
    "starter_cluster_count": 2,
    "starter_cluster_radius": 320
  },
  "obstacles": [
    {
      "id": "mars_rock_01",
      "sprite": "res://assets/original/obstacles/mars_freight/mars_rock_01_hd.webp",
      "weight": 24,
      "collision_radius": 55,
      "scale_min": 0.94,
      "scale_max": 1.16,
      "texture_reference_size": 128,
      "sprite_modulate": "#ffffffff"
    },
    {
      "id": "mars_rock_02",
      "sprite": "res://assets/original/obstacles/mars_freight/mars_rock_02_hd.webp",
      "weight": 22,
      "collision_radius": 48,
      "scale_min": 0.92,
      "scale_max": 1.14,
      "texture_reference_size": 128,
      "sprite_modulate": "#ffffffff"
    },
    {
      "id": "mars_rock_03",
      "sprite": "res://assets/original/obstacles/mars_freight/mars_rock_03_hd.webp",
      "weight": 20,
      "collision_radius": 40,
      "scale_min": 0.9,
      "scale_max": 1.14,
      "texture_reference_size": 128,
      "sprite_modulate": "#ffffffff"
    },
    {
      "id": "mars_rock_04",
      "sprite": "res://assets/original/obstacles/mars_freight/mars_rock_04_hd.webp",
      "weight": 18,
      "collision_radius": 34,
      "scale_min": 0.9,
      "scale_max": 1.16,
      "texture_reference_size": 128,
      "sprite_modulate": "#ffffffff"
    },
    {
      "id": "mars_rock_05",
      "sprite": "res://assets/original/obstacles/mars_freight/mars_rock_05_hd.webp",
      "weight": 16,
      "collision_radius": 27,
      "scale_min": 0.9,
      "scale_max": 1.2,
      "texture_reference_size": 128,
      "sprite_modulate": "#ffffffff"
    }
  ],
  "obstacle_art_family": "mars"
}
