{
  "id": "rhea_orbit",
  "display_name_key": "BIOME_RHEA_ORBIT",
  "palette": {
    "background": "#030812",
    "nebula": "#4c4e55",
    "accent": "#d9d2ca"
  },
  "visual_profile": {
    "primary_asset": "res://assets/original/destinations/rhea_orbit.svg",
    "primary_scale": 1.95,
    "primary_anchor": [
      0.2,
      0.25
    ],
    "primary_parallax": 0.04,
    "primary_rotation_speed": 0.004,
    "atmosphere_color": "#d9d2ca",
    "atmosphere_strength": 0.36,
    "shimmer_strength": 0.06,
    "traffic_count": 5,
    "dust_density": 0.91,
    "horizon_style": "orbit",
    "horizon_intensity": 0.55
  },
  "environment": {
    "salvage_mass_multiplier": 0.88,
    "volumes": [
      {
        "kind": "gravity_well",
        "count_range": [
          1,
          2
        ],
        "shape": "circle",
        "strength_range": [
          0.18,
          0.4
        ],
        "placement": "random",
        "color": "#d9d2ca",
        "secondary_color": "#4c4e55",
        "radius_range": [
          460,
          820
        ]
      }
    ]
  },
  "salvage_tables": [
    "lunar_belt_industry"
  ],
  "landmarks": [
    "service_satellite",
    "derelict_explorer"
  ],
  "modifiers": [
    "light_debris",
    "dense_debris",
    "valuable_salvage",
    "sparse_corridor",
    "meteor_front",
    "rich_recovery",
    "quiet_orbit"
  ],
  "spawn_rules": {
    "min_spacing": 140,
    "edge_margin": 330,
    "starter_cluster_count": 2,
    "starter_cluster_radius": 280
  },
  "obstacles": [
    {
      "id": "lunar_boulder_01",
      "sprite": "res://assets/original/obstacles/lunar_belt/lunar_boulder_01_hd.webp",
      "weight": 24,
      "collision_radius": 55,
      "scale_min": 0.94,
      "scale_max": 1.15,
      "texture_reference_size": 128,
      "sprite_modulate": "#ffffffff"
    },
    {
      "id": "lunar_boulder_02",
      "sprite": "res://assets/original/obstacles/lunar_belt/lunar_boulder_02_hd.webp",
      "weight": 22,
      "collision_radius": 48,
      "scale_min": 0.92,
      "scale_max": 1.14,
      "texture_reference_size": 128,
      "sprite_modulate": "#ffffffff"
    },
    {
      "id": "lunar_boulder_03",
      "sprite": "res://assets/original/obstacles/lunar_belt/lunar_boulder_03_hd.webp",
      "weight": 20,
      "collision_radius": 40,
      "scale_min": 0.9,
      "scale_max": 1.12,
      "texture_reference_size": 128,
      "sprite_modulate": "#ffffffff"
    },
    {
      "id": "lunar_boulder_04",
      "sprite": "res://assets/original/obstacles/lunar_belt/lunar_boulder_04_hd.webp",
      "weight": 18,
      "collision_radius": 34,
      "scale_min": 0.9,
      "scale_max": 1.14,
      "texture_reference_size": 128,
      "sprite_modulate": "#ffffffff"
    },
    {
      "id": "lunar_boulder_05",
      "sprite": "res://assets/original/obstacles/lunar_belt/lunar_boulder_05_hd.webp",
      "weight": 16,
      "collision_radius": 27,
      "scale_min": 0.88,
      "scale_max": 1.18,
      "texture_reference_size": 128,
      "sprite_modulate": "#ffffffff"
    }
  ],
  "obstacle_art_family": "lunar"
}
