{
  "id": "lava_world",
  "display_name_key": "BIOME_LAVA_WORLD",
  "palette": {
    "background": "#030812",
    "nebula": "#6e1e26",
    "accent": "#ffd05b"
  },
  "visual_profile": {
    "primary_asset": "res://assets/original/destinations/lava_world.svg",
    "primary_scale": 1.95,
    "primary_anchor": [
      0.5,
      0.25
    ],
    "primary_parallax": 0.04,
    "primary_rotation_speed": 0.004,
    "atmosphere_color": "#ffd05b",
    "atmosphere_strength": 0.36,
    "shimmer_strength": 0.1,
    "traffic_count": 5,
    "dust_density": 0.45,
    "horizon_style": "solar",
    "horizon_intensity": 0.55
  },
  "environment": {
    "salvage_mass_multiplier": 1.16,
    "volumes": [
      {
        "kind": "drift_current",
        "count_range": [
          1,
          2
        ],
        "shape": "box",
        "strength_range": [
          0.18,
          0.38
        ],
        "placement": "random",
        "color": "#ffd05b",
        "secondary_color": "#6e1e26",
        "length_range": [
          2400,
          4800
        ],
        "width_range": [
          520,
          980
        ]
      },
      {
        "kind": "tractor_distortion",
        "count_range": [
          1,
          2
        ],
        "shape": "circle",
        "strength_range": [
          0.24,
          0.48
        ],
        "placement": "random",
        "color": "#ffd05b",
        "secondary_color": "#6e1e26",
        "radius_range": [
          450,
          760
        ]
      }
    ]
  },
  "salvage_tables": [
    "blue_nebula_research"
  ],
  "landmarks": [
    "mining_rig"
  ],
  "modifiers": [
    "light_debris",
    "dense_debris",
    "valuable_salvage",
    "sparse_corridor",
    "meteor_front",
    "rich_recovery",
    "quiet_orbit"
  ],
  "spawn_rules": {
    "min_spacing": 140,
    "edge_margin": 355,
    "starter_cluster_count": 2,
    "starter_cluster_radius": 280
  },
  "obstacles": [
    {
      "id": "mars_rock_01",
      "sprite": "res://assets/original/obstacles/mars_freight/mars_rock_01_hd.webp",
      "weight": 24,
      "collision_radius": 55,
      "scale_min": 0.94,
      "scale_max": 1.16,
      "texture_reference_size": 128,
      "sprite_modulate": "#ffffffff"
    },
    {
      "id": "mars_rock_02",
      "sprite": "res://assets/original/obstacles/mars_freight/mars_rock_02_hd.webp",
      "weight": 22,
      "collision_radius": 48,
      "scale_min": 0.92,
      "scale_max": 1.14,
      "texture_reference_size": 128,
      "sprite_modulate": "#ffffffff"
    },
    {
      "id": "mars_rock_03",
      "sprite": "res://assets/original/obstacles/mars_freight/mars_rock_03_hd.webp",
      "weight": 20,
      "collision_radius": 40,
      "scale_min": 0.9,
      "scale_max": 1.14,
      "texture_reference_size": 128,
      "sprite_modulate": "#ffffffff"
    },
    {
      "id": "mars_rock_04",
      "sprite": "res://assets/original/obstacles/mars_freight/mars_rock_04_hd.webp",
      "weight": 18,
      "collision_radius": 34,
      "scale_min": 0.9,
      "scale_max": 1.16,
      "texture_reference_size": 128,
      "sprite_modulate": "#ffffffff"
    },
    {
      "id": "mars_rock_05",
      "sprite": "res://assets/original/obstacles/mars_freight/mars_rock_05_hd.webp",
      "weight": 16,
      "collision_radius": 27,
      "scale_min": 0.9,
      "scale_max": 1.2,
      "texture_reference_size": 128,
      "sprite_modulate": "#ffffffff"
    }
  ],
  "obstacle_art_family": "mars"
}
