{
  "id": "kepler_186f",
  "display_name_key": "BIOME_KEPLER_186F",
  "palette": {
    "background": "#030812",
    "nebula": "#21464b",
    "accent": "#78e2ad"
  },
  "visual_profile": {
    "primary_asset": "res://assets/original/destinations/kepler_186f_hd.webp",
    "primary_scale": 1.95,
    "primary_anchor": [
      0.8,
      0.25
    ],
    "primary_parallax": 0.056,
    "primary_rotation_speed": 0.004,
    "atmosphere_color": "#78e2ad",
    "atmosphere_strength": 0.52,
    "shimmer_strength": 0.14,
    "traffic_count": 3,
    "dust_density": 1.1400000000000001,
    "horizon_style": "orbit",
    "horizon_intensity": 0.75,
    "primary_reference_size": 512
  },
  "environment": {
    "salvage_mass_multiplier": 1.02,
    "volumes": [
      {
        "kind": "visibility_pocket",
        "count_range": [
          1,
          2
        ],
        "shape": "circle",
        "strength_range": [
          0.28,
          0.56
        ],
        "placement": "random",
        "color": "#78e2ad",
        "secondary_color": "#21464b",
        "radius_range": [
          520,
          920
        ]
      },
      {
        "kind": "safe_corridor",
        "count_range": [
          1,
          1
        ],
        "shape": "box",
        "strength_range": [
          0.72,
          0.95
        ],
        "placement": "depot",
        "color": "#78e2ad",
        "secondary_color": "#21464b",
        "length_range": [
          3200,
          5200
        ],
        "width_range": [
          560,
          920
        ]
      }
    ]
  },
  "salvage_tables": [
    "blue_nebula_research"
  ],
  "landmarks": [
    "research_outpost",
    "cargo_waystation"
  ],
  "modifiers": [
    "light_debris",
    "dense_debris",
    "valuable_salvage",
    "sparse_corridor",
    "meteor_front",
    "rich_recovery",
    "quiet_orbit"
  ],
  "spawn_rules": {
    "min_spacing": 156,
    "edge_margin": 380,
    "starter_cluster_count": 2,
    "starter_cluster_radius": 320
  },
  "obstacles": [
    {
      "id": "earth_meteorite_01",
      "sprite": "res://assets/original/obstacles/earth_orbit/earth_meteorite_01_hd.webp",
      "weight": 24,
      "collision_radius": 54,
      "scale_min": 0.92,
      "scale_max": 1.12,
      "texture_reference_size": 128,
      "sprite_modulate": "#ffffffff"
    },
    {
      "id": "earth_meteorite_02",
      "sprite": "res://assets/original/obstacles/earth_orbit/earth_meteorite_02_hd.webp",
      "weight": 22,
      "collision_radius": 47,
      "scale_min": 0.9,
      "scale_max": 1.12,
      "texture_reference_size": 128,
      "sprite_modulate": "#ffffffff"
    },
    {
      "id": "earth_meteorite_03",
      "sprite": "res://assets/original/obstacles/earth_orbit/earth_meteorite_03_hd.webp",
      "weight": 20,
      "collision_radius": 40,
      "scale_min": 0.9,
      "scale_max": 1.14,
      "texture_reference_size": 128,
      "sprite_modulate": "#ffffffff"
    },
    {
      "id": "earth_meteorite_04",
      "sprite": "res://assets/original/obstacles/earth_orbit/earth_meteorite_04_hd.webp",
      "weight": 18,
      "collision_radius": 33,
      "scale_min": 0.88,
      "scale_max": 1.16,
      "texture_reference_size": 128,
      "sprite_modulate": "#ffffffff"
    },
    {
      "id": "earth_meteorite_05",
      "sprite": "res://assets/original/obstacles/earth_orbit/earth_meteorite_05_hd.webp",
      "weight": 16,
      "collision_radius": 27,
      "scale_min": 0.88,
      "scale_max": 1.2,
      "texture_reference_size": 128,
      "sprite_modulate": "#ffffffff"
    }
  ],
  "obstacle_art_family": "earth"
}
