{
  "id": "earth_orbit",
  "display_name_key": "BIOME_EARTH_ORBIT",
  "palette": {
    "background": "#040b13",
    "nebula": "#0b3d4d",
    "accent": "#53d7f1"
  },
  "visual_profile": {
    "atmosphere_color": "#72e5ff",
    "atmosphere_strength": 0.48,
    "shimmer_strength": 0.09,
    "traffic_count": 9,
    "dust_density": 0.55,
    "primary_asset": "res://assets/original/planets/earth_orbit_hd.webp",
    "primary_scale": 0.98,
    "primary_anchor": [
      0.82,
      0.78
    ],
    "primary_parallax": 0.055,
    "primary_rotation_speed": 0.006,
    "horizon_style": "orbit",
    "horizon_intensity": 0.65,
    "effect_profile": "clean",
    "effect_intensity": 0.32
  },
  "environment": {
    "salvage_mass_multiplier": 1,
    "volumes": []
  },
  "salvage_tables": [
    "earth_training",
    "earth_orbit_ops"
  ],
  "landmarks": [
    "service_satellite",
    "cargo_waystation",
    "relay_satellite"
  ],
  "modifiers": [
    "light_debris",
    "dense_debris",
    "valuable_salvage",
    "sparse_corridor"
  ],
  "spawn_rules": {
    "min_spacing": 135,
    "edge_margin": 320,
    "starter_cluster_count": 3,
    "starter_cluster_radius": 270
  },
  "obstacles": [
    {
      "id": "earth_meteorite_01",
      "sprite": "res://assets/original/obstacles/earth_orbit/earth_meteorite_01_hd.webp",
      "weight": 24,
      "collision_radius": 54,
      "scale_min": 0.92,
      "scale_max": 1.12,
      "texture_reference_size": 128,
      "sprite_modulate": "#ffffffff"
    },
    {
      "id": "earth_meteorite_02",
      "sprite": "res://assets/original/obstacles/earth_orbit/earth_meteorite_02_hd.webp",
      "weight": 22,
      "collision_radius": 47,
      "scale_min": 0.9,
      "scale_max": 1.12,
      "texture_reference_size": 128,
      "sprite_modulate": "#ffffffff"
    },
    {
      "id": "earth_meteorite_03",
      "sprite": "res://assets/original/obstacles/earth_orbit/earth_meteorite_03_hd.webp",
      "weight": 20,
      "collision_radius": 40,
      "scale_min": 0.9,
      "scale_max": 1.14,
      "texture_reference_size": 128,
      "sprite_modulate": "#ffffffff"
    },
    {
      "id": "earth_meteorite_04",
      "sprite": "res://assets/original/obstacles/earth_orbit/earth_meteorite_04_hd.webp",
      "weight": 18,
      "collision_radius": 33,
      "scale_min": 0.88,
      "scale_max": 1.16,
      "texture_reference_size": 128,
      "sprite_modulate": "#ffffffff"
    },
    {
      "id": "earth_meteorite_05",
      "sprite": "res://assets/original/obstacles/earth_orbit/earth_meteorite_05_hd.webp",
      "weight": 16,
      "collision_radius": 27,
      "scale_min": 0.88,
      "scale_max": 1.2,
      "texture_reference_size": 128,
      "sprite_modulate": "#ffffffff"
    }
  ],
  "obstacle_art_family": "earth"
}
