{
  "id": "blue_nebula",
  "display_name_key": "BIOME_BLUE_NEBULA",
  "palette": {
    "background": "#030817",
    "nebula": "#183b72",
    "accent": "#72d7ff"
  },
  "visual_profile": {
    "atmosphere_color": "#91dfff",
    "atmosphere_strength": 0.58,
    "shimmer_strength": 0.15,
    "traffic_count": 3,
    "dust_density": 1.45,
    "primary_asset": "res://assets/original/planets/blue_giant_hd.webp",
    "primary_scale": 0.87,
    "primary_anchor": [
      0.2,
      0.23
    ],
    "primary_parallax": 0.045,
    "primary_rotation_speed": -0.005,
    "horizon_style": "nebula",
    "horizon_intensity": 0.82
  },
  "environment": {
    "salvage_mass_multiplier": 0.94,
    "volumes": [
      {
        "kind": "visibility_pocket",
        "count_range": [
          2,
          3
        ],
        "shape": "circle",
        "strength_range": [
          0.35,
          0.62
        ],
        "radius_range": [
          620,
          980
        ],
        "placement": "random",
        "color": "#72d7ff",
        "secondary_color": "#5849a5"
      },
      {
        "kind": "scanner_interference",
        "count_range": [
          1,
          2
        ],
        "shape": "circle",
        "strength_range": [
          0.35,
          0.62
        ],
        "radius_range": [
          480,
          760
        ],
        "placement": "random",
        "color": "#80dfff",
        "secondary_color": "#5a73d6"
      },
      {
        "kind": "tractor_distortion",
        "count_range": [
          1,
          2
        ],
        "shape": "circle",
        "strength_range": [
          0.3,
          0.55
        ],
        "radius_range": [
          460,
          720
        ],
        "placement": "random",
        "color": "#a28bff",
        "secondary_color": "#3157a5"
      },
      {
        "kind": "magnetic_zone",
        "count_range": [
          1,
          1
        ],
        "shape": "circle",
        "strength_range": [
          0.22,
          0.42
        ],
        "radius_range": [
          500,
          750
        ],
        "placement": "random",
        "color": "#9effe6",
        "secondary_color": "#365e9f"
      }
    ]
  },
  "salvage_tables": [
    "blue_nebula_research"
  ],
  "landmarks": [
    "research_outpost",
    "derelict_explorer",
    "comms_array"
  ],
  "modifiers": [
    "light_debris",
    "valuable_salvage",
    "rich_recovery",
    "quiet_orbit",
    "dense_debris"
  ],
  "spawn_rules": {
    "min_spacing": 160,
    "edge_margin": 380,
    "starter_cluster_count": 2,
    "starter_cluster_radius": 320
  },
  "obstacles": [
    {
      "id": "nebula_fragment_01",
      "sprite": "res://assets/original/obstacles/blue_nebula/nebula_fragment_01_hd.webp",
      "weight": 18,
      "collision_radius": 52,
      "visual_diameter": 128,
      "authored_color": true,
      "scale_min": 0.82,
      "scale_max": 1.08
    },
    {
      "id": "nebula_fragment_02",
      "sprite": "res://assets/original/obstacles/blue_nebula/nebula_fragment_02_hd.webp",
      "weight": 18,
      "collision_radius": 36,
      "visual_diameter": 94,
      "authored_color": true,
      "scale_min": 0.82,
      "scale_max": 1.08
    },
    {
      "id": "nebula_fragment_03",
      "sprite": "res://assets/original/obstacles/blue_nebula/nebula_fragment_03_hd.webp",
      "weight": 18,
      "collision_radius": 36,
      "visual_diameter": 94,
      "authored_color": true,
      "scale_min": 0.82,
      "scale_max": 1.08
    },
    {
      "id": "nebula_fragment_04",
      "sprite": "res://assets/original/obstacles/blue_nebula/nebula_fragment_04_hd.webp",
      "weight": 23,
      "collision_radius": 22,
      "visual_diameter": 62,
      "authored_color": true,
      "scale_min": 0.72,
      "scale_max": 1.05
    },
    {
      "id": "nebula_fragment_05",
      "sprite": "res://assets/original/obstacles/blue_nebula/nebula_fragment_05_hd.webp",
      "weight": 23,
      "collision_radius": 22,
      "visual_diameter": 62,
      "authored_color": true,
      "scale_min": 0.72,
      "scale_max": 1.05
    }
  ]
}
