{
  "id": "crystal_world",
  "display_name_key": "BIOME_CRYSTAL_WORLD",
  "palette": {
    "background": "#030812",
    "nebula": "#315298",
    "accent": "#b8fff5"
  },
  "visual_profile": {
    "primary_asset": "res://assets/original/destinations/crystal_world.svg",
    "primary_scale": 1.95,
    "primary_anchor": [
      0.5,
      0.75
    ],
    "primary_parallax": 0.064,
    "primary_rotation_speed": -0.004,
    "atmosphere_color": "#b8fff5",
    "atmosphere_strength": 0.6,
    "shimmer_strength": 0.1,
    "traffic_count": 1,
    "dust_density": 1.1400000000000001,
    "horizon_style": "anomaly",
    "horizon_intensity": 0.8500000000000001
  },
  "environment": {
    "salvage_mass_multiplier": 0.95,
    "volumes": [
      {
        "kind": "magnetic_zone",
        "count_range": [
          1,
          2
        ],
        "shape": "circle",
        "strength_range": [
          0.2,
          0.44
        ],
        "placement": "random",
        "color": "#b8fff5",
        "secondary_color": "#315298",
        "radius_range": [
          500,
          820
        ]
      },
      {
        "kind": "scanner_interference",
        "count_range": [
          1,
          2
        ],
        "shape": "circle",
        "strength_range": [
          0.28,
          0.54
        ],
        "placement": "random",
        "color": "#b8fff5",
        "secondary_color": "#315298",
        "radius_range": [
          460,
          780
        ]
      }
    ]
  },
  "salvage_tables": [
    "blue_nebula_research"
  ],
  "landmarks": [
    "research_outpost"
  ],
  "modifiers": [
    "light_debris",
    "dense_debris",
    "valuable_salvage",
    "sparse_corridor",
    "meteor_front",
    "rich_recovery",
    "quiet_orbit"
  ],
  "spawn_rules": {
    "min_spacing": 164,
    "edge_margin": 355,
    "starter_cluster_count": 3,
    "starter_cluster_radius": 340
  },
  "obstacles": [
    {
      "id": "nebula_fragment_01",
      "sprite": "res://assets/original/obstacles/blue_nebula/nebula_fragment_01_hd.webp",
      "weight": 20,
      "collision_radius": 52,
      "scale_min": 0.84,
      "scale_max": 1.06,
      "texture_reference_size": 128,
      "sprite_modulate": "#ffffffff"
    },
    {
      "id": "nebula_fragment_02",
      "sprite": "res://assets/original/obstacles/blue_nebula/nebula_fragment_02_hd.webp",
      "weight": 21,
      "collision_radius": 45,
      "scale_min": 0.82,
      "scale_max": 1.08,
      "texture_reference_size": 128,
      "sprite_modulate": "#ffffffff"
    },
    {
      "id": "nebula_fragment_03",
      "sprite": "res://assets/original/obstacles/blue_nebula/nebula_fragment_03_hd.webp",
      "weight": 20,
      "collision_radius": 38,
      "scale_min": 0.82,
      "scale_max": 1.08,
      "texture_reference_size": 128,
      "sprite_modulate": "#ffffffff"
    },
    {
      "id": "nebula_fragment_04",
      "sprite": "res://assets/original/obstacles/blue_nebula/nebula_fragment_04_hd.webp",
      "weight": 19,
      "collision_radius": 31,
      "scale_min": 0.8,
      "scale_max": 1.1,
      "texture_reference_size": 128,
      "sprite_modulate": "#ffffffff"
    },
    {
      "id": "nebula_fragment_05",
      "sprite": "res://assets/original/obstacles/blue_nebula/nebula_fragment_05_hd.webp",
      "weight": 20,
      "collision_radius": 24,
      "scale_min": 0.78,
      "scale_max": 1.12,
      "texture_reference_size": 128,
      "sprite_modulate": "#ffffffff"
    }
  ],
  "obstacle_art_family": "nebula"
}
