{
  "id": "venus_clouds",
  "display_name_key": "BIOME_VENUS_CLOUDS",
  "palette": {
    "background": "#030812",
    "nebula": "#8b5c3f",
    "accent": "#ffe0a0"
  },
  "visual_profile": {
    "primary_asset": "res://assets/original/destinations/venus_clouds.svg",
    "primary_scale": 1.95,
    "primary_anchor": [
      0.5,
      0.75
    ],
    "primary_parallax": 0.048,
    "primary_rotation_speed": -0.004,
    "atmosphere_color": "#ffe0a0",
    "atmosphere_strength": 0.44,
    "shimmer_strength": 0.1,
    "traffic_count": 1,
    "dust_density": 0.68,
    "horizon_style": "nebula",
    "horizon_intensity": 0.65
  },
  "environment": {
    "salvage_mass_multiplier": 0.95,
    "volumes": [
      {
        "kind": "visibility_pocket",
        "count_range": [
          1,
          2
        ],
        "shape": "circle",
        "strength_range": [
          0.28,
          0.56
        ],
        "placement": "random",
        "color": "#ffe0a0",
        "secondary_color": "#8b5c3f",
        "radius_range": [
          520,
          920
        ]
      },
      {
        "kind": "drift_current",
        "count_range": [
          1,
          2
        ],
        "shape": "box",
        "strength_range": [
          0.18,
          0.38
        ],
        "placement": "random",
        "color": "#ffe0a0",
        "secondary_color": "#8b5c3f",
        "length_range": [
          2400,
          4800
        ],
        "width_range": [
          520,
          980
        ]
      }
    ]
  },
  "salvage_tables": [
    "mars_freight"
  ],
  "landmarks": [
    "comms_array",
    "fractured_moonlet"
  ],
  "modifiers": [
    "light_debris",
    "dense_debris",
    "valuable_salvage",
    "sparse_corridor",
    "meteor_front",
    "rich_recovery",
    "quiet_orbit"
  ],
  "spawn_rules": {
    "min_spacing": 148,
    "edge_margin": 355,
    "starter_cluster_count": 3,
    "starter_cluster_radius": 300
  },
  "obstacles": [
    {
      "id": "mars_rock_01",
      "sprite": "res://assets/original/obstacles/mars_freight/mars_rock_01_hd.webp",
      "weight": 24,
      "collision_radius": 55,
      "scale_min": 0.94,
      "scale_max": 1.16,
      "texture_reference_size": 128,
      "sprite_modulate": "#ffffffff"
    },
    {
      "id": "mars_rock_02",
      "sprite": "res://assets/original/obstacles/mars_freight/mars_rock_02_hd.webp",
      "weight": 22,
      "collision_radius": 48,
      "scale_min": 0.92,
      "scale_max": 1.14,
      "texture_reference_size": 128,
      "sprite_modulate": "#ffffffff"
    },
    {
      "id": "mars_rock_03",
      "sprite": "res://assets/original/obstacles/mars_freight/mars_rock_03_hd.webp",
      "weight": 20,
      "collision_radius": 40,
      "scale_min": 0.9,
      "scale_max": 1.14,
      "texture_reference_size": 128,
      "sprite_modulate": "#ffffffff"
    },
    {
      "id": "mars_rock_04",
      "sprite": "res://assets/original/obstacles/mars_freight/mars_rock_04_hd.webp",
      "weight": 18,
      "collision_radius": 34,
      "scale_min": 0.9,
      "scale_max": 1.16,
      "texture_reference_size": 128,
      "sprite_modulate": "#ffffffff"
    },
    {
      "id": "mars_rock_05",
      "sprite": "res://assets/original/obstacles/mars_freight/mars_rock_05_hd.webp",
      "weight": 16,
      "collision_radius": 27,
      "scale_min": 0.9,
      "scale_max": 1.2,
      "texture_reference_size": 128,
      "sprite_modulate": "#ffffffff"
    }
  ],
  "obstacle_art_family": "mars"
}
